{
  "schemaVersion": "1.0",
  "kind": "workflow-classification",
  "labelPolicy": "Redacted intent only; canonical taxonomy; case-specific compiled graph; external review required before use as held-out ground truth",
  "cases": [
    {
      "id": "p-01",
      "summary": "Correct a typo in an existing settings label",
      "profile": "patch",
      "assurance": "normal",
      "riskTriggers": [],
      "rationale": [
        "single text change",
        "no public contract"
      ],
      "expectedChecks": [
        "lint",
        "unit-test"
      ],
      "review": {
        "status": "pending-external",
        "labeler": "codex"
      },
      "profileRecommendation": "patch",
      "split": "train",
      "compileSignals": {
        "uiFlow": false,
        "apiContract": false,
        "dataModel": false,
        "architecture": false,
        "externalIntegration": false,
        "publicContract": false,
        "multiArea": false,
        "highUncertainty": false,
        "newProduct": false,
        "ceoAnalysisAvailable": false
      },
      "expectedCompiledPhaseGraph": {
        "required": [
          "plan",
          "do",
          "qa"
        ],
        "conditional": [],
        "notRequired": [
          "ideation",
          "design",
          "report"
        ]
      }
    },
    {
      "id": "p-02",
      "summary": "기존 parser 분기에 null guard를 추가해줘",
      "profile": "patch",
      "assurance": "normal",
      "riskTriggers": [],
      "rationale": [
        "localized behavior fix",
        "single module"
      ],
      "expectedChecks": [
        "lint",
        "unit-test"
      ],
      "review": {
        "status": "pending-external",
        "labeler": "codex"
      },
      "profileRecommendation": "patch",
      "split": "train",
      "compileSignals": {
        "uiFlow": false,
        "apiContract": false,
        "dataModel": false,
        "architecture": false,
        "externalIntegration": false,
        "publicContract": false,
        "multiArea": false,
        "highUncertainty": false,
        "newProduct": false,
        "ceoAnalysisAvailable": false
      },
      "expectedCompiledPhaseGraph": {
        "required": [
          "plan",
          "do",
          "qa"
        ],
        "conditional": [],
        "notRequired": [
          "ideation",
          "design",
          "report"
        ]
      }
    },
    {
      "id": "p-03",
      "summary": "기존 모바일 toolbar의 간격 오류를 수정해줘",
      "profile": "patch",
      "assurance": "normal",
      "riskTriggers": [],
      "rationale": [
        "localized CSS change",
        "existing interaction"
      ],
      "expectedChecks": [
        "lint",
        "visual-regression"
      ],
      "review": {
        "status": "pending-external",
        "labeler": "codex"
      },
      "profileRecommendation": "patch",
      "split": "train",
      "compileSignals": {
        "uiFlow": false,
        "apiContract": false,
        "dataModel": false,
        "architecture": false,
        "externalIntegration": false,
        "publicContract": false,
        "multiArea": false,
        "highUncertainty": false,
        "newProduct": false,
        "ceoAnalysisAvailable": false
      },
      "expectedCompiledPhaseGraph": {
        "required": [
          "plan",
          "do",
          "qa"
        ],
        "conditional": [],
        "notRequired": [
          "ideation",
          "design",
          "report"
        ]
      }
    },
    {
      "id": "p-04",
      "summary": "Update a stale unit test assertion after a copy change",
      "profile": "patch",
      "assurance": "normal",
      "riskTriggers": [],
      "rationale": [
        "test-only correction",
        "no production contract"
      ],
      "expectedChecks": [
        "unit-test"
      ],
      "review": {
        "status": "pending-external",
        "labeler": "codex"
      },
      "profileRecommendation": "patch",
      "split": "train",
      "compileSignals": {
        "uiFlow": false,
        "apiContract": false,
        "dataModel": false,
        "architecture": false,
        "externalIntegration": false,
        "publicContract": false,
        "multiArea": false,
        "highUncertainty": false,
        "newProduct": false,
        "ceoAnalysisAvailable": false
      },
      "expectedCompiledPhaseGraph": {
        "required": [
          "plan",
          "do",
          "qa"
        ],
        "conditional": [],
        "notRequired": [
          "ideation",
          "design",
          "report"
        ]
      }
    },
    {
      "id": "p-05",
      "summary": "Clarify the wording of an existing parser error message",
      "profile": "patch",
      "assurance": "normal",
      "riskTriggers": [],
      "rationale": [
        "single logging statement",
        "no data shape change"
      ],
      "expectedChecks": [
        "lint",
        "unit-test"
      ],
      "review": {
        "status": "pending-external",
        "labeler": "codex"
      },
      "profileRecommendation": "patch",
      "split": "train",
      "compileSignals": {
        "uiFlow": false,
        "apiContract": false,
        "dataModel": false,
        "architecture": false,
        "externalIntegration": false,
        "publicContract": false,
        "multiArea": false,
        "highUncertainty": false,
        "newProduct": false,
        "ceoAnalysisAvailable": false
      },
      "expectedCompiledPhaseGraph": {
        "required": [
          "plan",
          "do",
          "qa"
        ],
        "conditional": [],
        "notRequired": [
          "ideation",
          "design",
          "report"
        ]
      }
    },
    {
      "id": "p-06",
      "summary": "Patch a vulnerable direct dependency without API changes",
      "profile": "patch",
      "assurance": "high",
      "riskTriggers": [
        "dependency"
      ],
      "rationale": [
        "bounded version update",
        "supply-chain risk"
      ],
      "expectedChecks": [
        "dependency-scan",
        "e2e-test"
      ],
      "review": {
        "status": "pending-external",
        "labeler": "codex"
      },
      "profileRecommendation": "patch",
      "split": "train",
      "compileSignals": {
        "uiFlow": false,
        "apiContract": false,
        "dataModel": false,
        "architecture": false,
        "externalIntegration": false,
        "publicContract": false,
        "multiArea": false,
        "highUncertainty": false,
        "newProduct": false,
        "ceoAnalysisAvailable": false
      },
      "expectedCompiledPhaseGraph": {
        "required": [
          "plan",
          "do",
          "qa"
        ],
        "conditional": [],
        "notRequired": [
          "ideation",
          "design",
          "report"
        ]
      }
    },
    {
      "id": "p-07",
      "summary": "Correct access token expiry handling in login refresh",
      "profile": "patch",
      "assurance": "high",
      "riskTriggers": [
        "auth"
      ],
      "rationale": [
        "localized auth fix",
        "session security impact"
      ],
      "expectedChecks": [
        "auth-test",
        "security-review",
        "rollback-test"
      ],
      "review": {
        "status": "pending-external",
        "labeler": "codex"
      },
      "profileRecommendation": "patch",
      "split": "train",
      "compileSignals": {
        "uiFlow": false,
        "apiContract": false,
        "dataModel": false,
        "architecture": false,
        "externalIntegration": false,
        "publicContract": false,
        "multiArea": false,
        "highUncertainty": false,
        "newProduct": false,
        "ceoAnalysisAvailable": false
      },
      "expectedCompiledPhaseGraph": {
        "required": [
          "plan",
          "do",
          "qa"
        ],
        "conditional": [],
        "notRequired": [
          "ideation",
          "design",
          "report"
        ]
      }
    },
    {
      "id": "p-08",
      "summary": "Fix payment total rounding for an existing currency",
      "profile": "patch",
      "assurance": "high",
      "riskTriggers": [
        "payment"
      ],
      "rationale": [
        "localized calculation",
        "financial impact"
      ],
      "expectedChecks": [
        "unit-test",
        "regression-test",
        "rollback-test",
        "security-review"
      ],
      "review": {
        "status": "pending-external",
        "labeler": "codex"
      },
      "profileRecommendation": "patch",
      "split": "train",
      "compileSignals": {
        "uiFlow": false,
        "apiContract": false,
        "dataModel": false,
        "architecture": false,
        "externalIntegration": false,
        "publicContract": false,
        "multiArea": false,
        "highUncertainty": false,
        "newProduct": false,
        "ceoAnalysisAvailable": false
      },
      "expectedCompiledPhaseGraph": {
        "required": [
          "plan",
          "do",
          "qa"
        ],
        "conditional": [],
        "notRequired": [
          "ideation",
          "design",
          "report"
        ]
      }
    },
    {
      "id": "p-09",
      "summary": "Mask an existing email field in diagnostic output",
      "profile": "patch",
      "assurance": "high",
      "riskTriggers": [
        "pii"
      ],
      "rationale": [
        "localized redaction",
        "personal data exposure"
      ],
      "expectedChecks": [
        "pii-scan",
        "regression-test"
      ],
      "review": {
        "status": "pending-external",
        "labeler": "codex"
      },
      "profileRecommendation": "patch",
      "split": "train",
      "compileSignals": {
        "uiFlow": false,
        "apiContract": false,
        "dataModel": false,
        "architecture": false,
        "externalIntegration": false,
        "publicContract": false,
        "multiArea": false,